,title,year_of_release,runtime,genre,imdb_rating,metascore,description,director,stars,votes
0,The Batman,2022,176 ,"Action, Crime, Drama",8.3,72,"When the Riddler, a sadistic serial killer, begins murdering key political figures in Gotham, Batman is forced to investigate the city's hidden corruption and question his family's involvement.",Matt Reeves,"Robert Pattinson, Zoë Kravitz, Jeffrey Wright, Colin Farrell",326233
1,CODA,2021,111 ,"Comedy, Drama, Music",8.0,74,"As a CODA (Child of Deaf Adults) Ruby is the only hearing person in her deaf family. When the family's fishing business is threatened, Ruby finds herself torn between pursuing her passion at Berklee College of Music and her fear of abandoning her parents.",Sian Heder,"Emilia Jones, Marlee Matlin, Troy Kotsur, Daniel Durant",95614
2,RRR,2022,187 ,"Action, Drama",8.9,88,A fictitious story about two legendary revolutionaries and their journey away from home before they started fighting for their country in 1920's.,S.S. Rajamouli,"N.T. Rama Rao Jr., Ram Charan, Ajay Devgn, Alia Bhatt",52997
3,Spider-Man: No Way Home,2021,148 ,"Action, Adventure, Fantasy",8.5,71,"With Spider-Man's identity now revealed, Peter asks Doctor Strange for help. When a spell goes wrong, dangerous foes from other worlds start to appear, forcing Peter to discover what it truly means to be Spider-Man.",Jon Watts,"Tom Holland, Zendaya, Benedict Cumberbatch, Jacob Batalon",586390
4,Dune,2021,155 ,"Action, Adventure, Drama",8.1,74,A noble family becomes embroiled in a war for control over the galaxy's most valuable asset while its heir becomes troubled by visions of a dark future.,Denis Villeneuve,"Timothée Chalamet, Rebecca Ferguson, Zendaya, Oscar Isaac",543079
5,The Worst Person in the World,2021,128 ,"Comedy, Drama, Romance",7.9,90,"The chronicles of four years in the life of Julie, a young woman who navigates the troubled waters of her love life and struggles to find her career path, leading her to take a realistic look at who she really is.",Joachim Trier,"Renate Reinsve, Anders Danielsen Lie, Herbert Nordrum, Hans Olav Brenner",36988
6,The Dark Knight,2008,152 ,"Action, Crime, Drama",9.0,84,"When the menace known as the Joker wreaks havoc and chaos on the people of Gotham, Batman must accept one of the greatest psychological and physical tests of his ability to fight injustice.",Christopher Nolan,"Christian Bale, Heath Ledger, Aaron Eckhart, Michael Caine",2540281
7,Drive My Car,2021,179 ,Drama,7.6,91,A renowned stage actor and director learns to cope with his wife's unexpected passing when he receives an offer to direct a production of Uncle Vanya in Hiroshima.,Ryûsuke Hamaguchi,"Hidetoshi Nishijima, Tôko Miura, Reika Kirishima, Park Yu-rim",34741
8,The Godfather,1972,175 ,"Crime, Drama",9.2,100,The aging patriarch of an organized crime dynasty in postwar New York City transfers control of his clandestine empire to his reluctant youngest son.,Francis Ford Coppola,"Marlon Brando, Al Pacino, James Caan, Diane Keaton",1772121
9,Blade Runner 2049,2017,164 ,"Action, Drama, Mystery",8.0,81,"Young Blade Runner K's discovery of a long-buried secret leads him to track down former Blade Runner Rick Deckard, who's been missing for thirty years.",Denis Villeneuve,"Harrison Ford, Ryan Gosling, Ana de Armas, Dave Bautista",535897
10,The Shawshank Redemption,1994,142 ,Drama,9.3,81,"Two imprisoned men bond over a number of years, finding solace and eventual redemption through acts of common decency.",Frank Darabont,"Tim Robbins, Morgan Freeman, Bob Gunton, William Sadler",2573557
11,Avengers: Endgame,2019,181 ,"Action, Adventure, Drama",8.4,78,"After the devastating events of Avengers: Infinity War (2018), the universe is in ruins. With the help of remaining allies, the Avengers assemble once more in order to reverse Thanos' actions and restore balance to the universe.","Anthony Russo, Joe Russo","    Stars:Robert Downey Jr., Chris Evans, Mark Ruffalo, Chris Hemsworth",Votes:
12,Zack Snyder's Justice League,2021,242 ,"Action, Adventure, Fantasy",8.1,54,"Determined to ensure Superman's ultimate sacrifice was not in vain, Bruce Wayne aligns forces with Diana Prince with plans to recruit a team of metahumans to protect the world from an approaching threat of catastrophic proportions.",Zack Snyder,"Henry Cavill, Ben Affleck, Gal Gadot, Amy Adams",372128
13,Harry Potter and the Sorcerer's Stone,2001,152 ,"Adventure, Family, Fantasy",7.6,65,"An orphaned boy enrolls in a school of wizardry, where he learns the truth about himself, his family and the terrible evil that haunts the magical world.",Chris Columbus,"Daniel Radcliffe, Rupert Grint, Richard Harris, Maggie Smith",748210
14,Interstellar,2014,169 ,"Adventure, Drama, Sci-Fi",8.6,74,A team of explorers travel through a wormhole in space in an attempt to ensure humanity's survival.,Christopher Nolan,"Matthew McConaughey, Anne Hathaway, Jessica Chastain, Mackenzie Foy",1717697
15,The Wolf of Wall Street,2013,180 ,"Biography, Comedy, Crime",8.2,75,"Based on the true story of Jordan Belfort, from his rise to a wealthy stock-broker living the high life to his fall involving crime, corruption and the federal government.",Martin Scorsese,"Leonardo DiCaprio, Jonah Hill, Margot Robbie, Matthew McConaughey",1332793
16,Once Upon a Time... In Hollywood,2019,161 ,"Comedy, Drama",7.6,83,A faded television actor and his stunt double strive to achieve fame and success in the final years of Hollywood's Golden Age in 1969 Los Angeles.,Quentin Tarantino,"Leonardo DiCaprio, Brad Pitt, Margot Robbie, Emile Hirsch",682452
17,The Blind Side,2009,129 ,"Biography, Drama, Sport",7.6,53,"The story of Michael Oher, a homeless and traumatized boy who became an All-American football player and first-round NFL draft pick with the help of a caring woman and her family.",John Lee Hancock,"Quinton Aaron, Sandra Bullock, Tim McGraw, Jae Head",322071
18,Pulp Fiction,1994,154 ,"Crime, Drama",8.9,94,"The lives of two mob hitmen, a boxer, a gangster and his wife, and a pair of diner bandits intertwine in four tales of violence and redemption.",Quentin Tarantino,"John Travolta, Uma Thurman, Samuel L. Jackson, Bruce Willis",1975265
19,Joker,I 2019,122 ,"Crime, Drama, Thriller",8.4,59,A mentally troubled stand-up comedian embarks on a downward spiral that leads to the creation of an iconic villain.,Todd Phillips,"Joaquin Phoenix, Robert De Niro, Zazie Beetz, Frances Conroy",1177403
20,American Psycho,2000,102 ,"Crime, Drama, Horror",7.6,64,"A wealthy New York City investment banking executive, Patrick Bateman, hides his alternate psychopathic ego from his co-workers and friends as he delves deeper into his violent, hedonistic fantasies.",Mary Harron,"Christian Bale, Justin Theroux, Josh Lucas, Bill Sage",561016
21,Titanic,1997,194 ,"Drama, Romance",7.9,75,"A seventeen-year-old aristocrat falls in love with a kind but poor artist aboard the luxurious, ill-fated R.M.S. Titanic.",James Cameron,"Leonardo DiCaprio, Kate Winslet, Billy Zane, Kathy Bates",1128973
22,Inception,2010,148 ,"Action, Adventure, Sci-Fi",8.8,74,"A thief who steals corporate secrets through the use of dream-sharing technology is given the inverse task of planting an idea into the mind of a C.E.O., but his tragic past may doom the project and his team to disaster.",Christopher Nolan,"Leonardo DiCaprio, Joseph Gordon-Levitt, Elliot Page, Ken Watanabe",2258722
23,Argo,2012,120 ,"Biography, Drama, Thriller",7.7,86,"Acting under the cover of a Hollywood producer scouting a location for a science fiction film, a CIA agent launches a dangerous operation to rescue six Americans in Tehran during the U.S. hostage crisis in Iran in 1979.",Ben Affleck,"Ben Affleck, Bryan Cranston, John Goodman, Alan Arkin",603969
24,The Dark Knight Rises,2012,164 ,"Action, Crime, Drama",8.4,78,"Eight years after the Joker's reign of anarchy, Batman, with the help of the enigmatic Catwoman, is forced from his exile to save Gotham City from the brutal guerrilla terrorist Bane.",Christopher Nolan,"Christian Bale, Tom Hardy, Anne Hathaway, Gary Oldman",1643974
25,Knives Out,2019,130 ,"Comedy, Crime, Drama",7.9,82,"A detective investigates the death of the patriarch of an eccentric, combative family.",Rian Johnson,"Daniel Craig, Chris Evans, Ana de Armas, Jamie Lee Curtis",584726
26,Batman Begins,2005,140 ,"Action, Crime, Drama",8.2,70,"After training with his mentor, Batman begins his fight to free crime-ridden Gotham City from corruption.",Christopher Nolan,"Christian Bale, Michael Caine, Ken Watanabe, Liam Neeson",1419283
27,Fight Club,1999,139 ,Drama,8.8,66,An insomniac office worker and a devil-may-care soap maker form an underground fight club that evolves into much more.,David Fincher,"Brad Pitt, Edward Norton, Meat Loaf, Zach Grenier",2025323
28,The Imitation Game,2014,114 ,"Biography, Drama, Thriller",8.0,71,"During World War II, the English mathematical genius Alan Turing tries to crack the German Enigma code with help from fellow mathematicians while attempting to come to terms with his troubled private life.",Morten Tyldum,"Benedict Cumberbatch, Keira Knightley, Matthew Goode, Allen Leech",745083
29,Parasite,2019,132 ,"Comedy, Drama, Horror",8.5,96,Greed and class discrimination threaten the newly formed symbiotic relationship between the wealthy Park family and the destitute Kim clan.,Bong Joon Ho,"Kang-ho Song, Sun-kyun Lee, Yeo-jeong Cho, Choi Woo-sik",734714
30,Mad Max: Fury Road,2015,120 ,"Action, Adventure, Sci-Fi",8.1,90,"In a post-apocalyptic wasteland, a woman rebels against a tyrannical ruler in search for her homeland with the aid of a group of female prisoners, a psychotic worshiper, and a drifter named Max.",George Miller,"Tom Hardy, Charlize Theron, Nicholas Hoult, Zoë Kravitz",964308
31,Requiem for a Dream,2000,102 ,Drama,8.3,68,The drug-induced utopias of four Coney Island people are shattered when their addictions run deep.,Darren Aronofsky,"Ellen Burstyn, Jared Leto, Jennifer Connelly, Marlon Wayans",817955
32,Prisoners,2013,153 ,"Crime, Drama, Mystery",8.1,70,"When Keller Dover's daughter and her friend go missing, he takes matters into his own hands as the police pursue multiple leads and the pressure mounts.",Denis Villeneuve,"Hugh Jackman, Jake Gyllenhaal, Viola Davis, Melissa Leo",675094
33,Django Unchained,2012,165 ,"Drama, Western",8.4,81,"With the help of a German bounty-hunter, a freed slave sets out to rescue his wife from a brutal plantation-owner in Mississippi.",Quentin Tarantino,"Jamie Foxx, Christoph Waltz, Leonardo DiCaprio, Kerry Washington",1487578
34,The Green Mile,1999,189 ,"Crime, Drama, Fantasy",8.6,61,"The lives of guards on Death Row are affected by one of their charges: a black man accused of child murder and rape, yet who has a mysterious gift.",Frank Darabont,"Tom Hanks, Michael Clarke Duncan, David Morse, Bonnie Hunt",1251460
35,Avengers: Infinity War,2018,149 ,"Action, Adventure, Sci-Fi",8.5,68,The Avengers and their allies must be willing to sacrifice all in an attempt to defeat the powerful Thanos before his blitz of devastation and ruin puts an end to the universe.,"Anthony Russo, Joe Russo","    Stars:Robert Downey Jr., Chris Hemsworth, Mark Ruffalo, Chris Evans",Votes:
36,Dunkirk,2017,106 ,"Action, Drama, History",7.8,94,"Allied soldiers from Belgium, the British Commonwealth and Empire, and France are surrounded by the German Army and evacuated during a fierce battle in World War II.",Christopher Nolan,"Fionn Whitehead, Barry Keoghan, Mark Rylance, Tom Hardy",628353
37,The Lord of the Rings: The Fellowship of the Ring,2001,178 ,"Action, Adventure, Drama",8.8,92,A meek Hobbit from the Shire and eight companions set out on a journey to destroy the powerful One Ring and save Middle-earth from the Dark Lord Sauron.,Peter Jackson,"Elijah Wood, Ian McKellen, Orlando Bloom, Sean Bean",1791674
38,Taxi Driver,1976,114 ,"Crime, Drama",8.3,94,"A mentally unstable veteran works as a nighttime taxi driver in New York City, where the perceived decadence and sleaze fuels his urge for violent action.",Martin Scorsese,"Robert De Niro, Jodie Foster, Cybill Shepherd, Albert Brooks",792196
39,Inglourious Basterds,2009,153 ,"Adventure, Drama, War",8.3,69,"In Nazi-occupied France during World War II, a plan to assassinate Nazi leaders by a group of Jewish U.S. soldiers coincides with a theatre owner's vengeful plans for the same.",Quentin Tarantino,"Brad Pitt, Diane Kruger, Eli Roth, Mélanie Laurent",1387508
40,Ex Machina,2014,108 ,"Drama, Sci-Fi, Thriller",7.7,78,A young programmer is selected to participate in a ground-breaking experiment in synthetic intelligence by evaluating the human qualities of a highly advanced humanoid A.I.,Alex Garland,"Alicia Vikander, Domhnall Gleeson, Oscar Isaac, Sonoya Mizuno",523250
41,Schindler's List,1993,195 ,"Biography, Drama, History",9.0,94,"In German-occupied Poland during World War II, industrialist Oskar Schindler gradually becomes concerned for his Jewish workforce after witnessing their persecution by the Nazis.",Steven Spielberg,"Liam Neeson, Ralph Fiennes, Ben Kingsley, Caroline Goodall",1310894
42,Saving Private Ryan,1998,169 ,"Drama, War",8.6,91,"Following the Normandy Landings, a group of U.S. soldiers go behind enemy lines to retrieve a paratrooper whose brothers have been killed in action.",Steven Spielberg,"Tom Hanks, Matt Damon, Tom Sizemore, Edward Burns",1340598
43,The Gentlemen,2019,113 ,"Action, Comedy, Crime",7.8,51,"An American expat tries to sell off his highly profitable marijuana empire in London, triggering plots, schemes, bribery and blackmail in an attempt to steal his domain out from under him.",Guy Ritchie,"Matthew McConaughey, Charlie Hunnam, Michelle Dockery, Jeremy Strong",309755
44,Call Me by Your Name,2017,132 ,"Drama, Romance",7.9,93,"In 1980s Italy, romance blossoms between a seventeen-year-old student and the older man hired as his father's research assistant.",Luca Guadagnino,"Armie Hammer, Timothée Chalamet, Michael Stuhlbarg, Amira Casar",255388
45,Se7en,1995,127 ,"Crime, Drama, Mystery",8.6,65,"Two detectives, a rookie and a veteran, hunt a serial killer who uses the seven deadly sins as his motives.",David Fincher,"Morgan Freeman, Brad Pitt, Kevin Spacey, Andrew Kevin Walker",1578458
46,Die Hard,1988,132 ,"Action, Thriller",8.2,72,An NYPD officer tries to save his wife and several others taken hostage by German terrorists during a Christmas party at the Nakatomi Plaza in Los Angeles.,John McTiernan,"Bruce Willis, Alan Rickman, Bonnie Bedelia, Reginald VelJohnson",854607
47,Bohemian Rhapsody,2018,134 ,"Biography, Drama, Music",7.9,49,"The story of the legendary British rock band Queen and lead singer Freddie Mercury, leading up to their famous performance at Live Aid (1985).",Bryan Singer,"Rami Malek, Lucy Boynton, Gwilym Lee, Ben Hardy",513735
48,The Fifth Element,1997,126 ,"Action, Adventure, Sci-Fi",7.6,52,"In the colorful future, a cab driver unwittingly becomes the central figure in the search for a legendary cosmic weapon to keep Evil and Mr. Zorg at bay.",Luc Besson,"Bruce Willis, Milla Jovovich, Gary Oldman, Ian Holm",461925
49,Forrest Gump,1994,142 ,"Drama, Romance",8.8,82,"The presidencies of Kennedy and Johnson, the Vietnam War, the Watergate scandal and other historical events unfold from the perspective of an Alabama man with an IQ of 75, whose only desire is to be reunited with his childhood sweetheart.",Robert Zemeckis,"Tom Hanks, Robin Wright, Gary Sinise, Sally Field",1985179
